{
  "$schema": "ops/schemas/release-workflow-order-guard-spec.schema.json",
  "version": 1,
  "target_recipe_order": [
    "release-evidence-converge",
    "release-converge-preflight",
    "check-finalized",
    "release-finality-resettle",
    "release-terminal-finality",
    "release-authority-post-ready-finality",
    "release-authority-settle",
    "release-auto-promotion-preflight-prerequisites",
    "release-auto-promotion-preflight",
    "release-auto-promotion-preseal",
    "release-source-ready",
    "release-source-ready-prepare",
    "release-source-ready-post-verify",
    "release-post-commit-finalize"
  ],
  "role_overrides": [
    {
      "target": "release-closeout-post-check-finalizer-dry-run",
      "required_assignments": {
        "RELEASE_CLOSEOUT_POST_CHECK_FINALIZER_FLAGS": "--fail-on-refresh-required"
      },
      "role": "release-closeout-post-check-finalizer-strict-dry-run"
    },
    {
      "target": "auto-improve-readiness-report-body",
      "required_assignments": {
        "AUTO_IMPROVE_READINESS_WORKTREE_GUARD_REFRESH": "1"
      },
      "role": "auto-improve-readiness-report-body-worktree-guard-refresh"
    },
    {
      "target": "release-run-ready-plan-check",
      "required_assignments": {
        "RELEASE_CLOSEOUT_DISTRIBUTION_ZIP": "$(RELEASE_AUTO_PROMOTION_EFFECTIVE_DISTRIBUTION_ZIP)"
      },
      "role": "release-run-ready-plan-check-auto-promotion-distribution"
    },
    {
      "target": "release-run-ready-check",
      "required_assignments": {
        "RELEASE_CLOSEOUT_DISTRIBUTION_ZIP": "$(RELEASE_AUTO_PROMOTION_EFFECTIVE_DISTRIBUTION_ZIP)"
      },
      "role": "release-run-ready-check-auto-promotion-distribution"
    },
    {
      "target": "release-evidence-cohort-preseal-refresh",
      "required_assignments": {
        "RELEASE_EVIDENCE_COHORT_ZIP_METADATA": "$(RELEASE_AUTO_PROMOTION_EFFECTIVE_ZIP_METADATA)"
      },
      "role": "release-evidence-cohort-preseal-refresh-auto-promotion-metadata"
    },
    {
      "target": "release-closeout-fixed-point",
      "required_assignments": {
        "RELEASE_CLOSEOUT_BATCH_MANIFEST_ZIP_METADATA": "$(RELEASE_AUTO_PROMOTION_EFFECTIVE_ZIP_METADATA)",
        "RELEASE_CLOSEOUT_DISTRIBUTION_ZIP": "$(RELEASE_AUTO_PROMOTION_EFFECTIVE_DISTRIBUTION_ZIP)"
      },
      "role": "release-closeout-fixed-point-auto-promotion-artifacts"
    },
    {
      "target": "release-run-ready",
      "required_assignments": {
        "RELEASE_CLOSEOUT_DISTRIBUTION_ZIP": "$(RELEASE_AUTO_PROMOTION_EFFECTIVE_DISTRIBUTION_ZIP)"
      },
      "role": "release-run-ready-auto-promotion-distribution"
    },
    {
      "target": "release-evidence-cohort",
      "required_assignments": {
        "RELEASE_EVIDENCE_COHORT_POLICY": "strict_same_fingerprint",
        "RELEASE_EVIDENCE_COHORT_ZIP_METADATA": "$(RELEASE_AUTO_PROMOTION_EFFECTIVE_ZIP_METADATA)"
      },
      "role": "release-evidence-cohort-strict-same-fingerprint-auto-promotion-metadata"
    }
  ],
  "role_override_sequence_coverage": {
    "allowlisted_roles": [],
    "details": "Observed role overrides must be named in the expected subsequence for the target where they appear, unless an override is intentionally allowlisted here."
  },
  "protected_recipes": [
    {
      "id": "release_post_commit_finalizer_protected_recipe",
      "target": "release-post-commit-finalize",
      "expected_lines": [
        {
          "role": "release-post-commit-finalizer-snapshot",
          "target": "release-post-commit-finalizer-snapshot",
          "raw_line": "$(PYTHON) -m ops.scripts.release.release_post_commit_finalizer --vault \"$(VAULT)\" --mode snapshot --out \"$(RELEASE_POST_COMMIT_FINALIZATION_SNAPSHOT_OUT)\""
        },
        {
          "role": "script-output-surfaces-check",
          "target": "script-output-surfaces-check",
          "raw_line": "$(MAKE) script-output-surfaces-check"
        },
        {
          "role": "release-smoke-fast-current-check",
          "target": "release-smoke-fast-current-check",
          "raw_line": "$(MAKE) release-smoke-fast-current-check"
        },
        {
          "role": "test-execution-summary-current-check",
          "target": "test-execution-summary-current-check",
          "raw_line": "$(MAKE) test-execution-summary-current-check"
        },
        {
          "role": "test-execution-summary-full-current-check",
          "target": "test-execution-summary-full-current-check",
          "raw_line": "$(MAKE) test-execution-summary-full-current-check"
        },
        {
          "role": "sync-public-policy-check",
          "target": "sync-public-policy-check",
          "raw_line": "$(MAKE) sync-public-policy-check"
        },
        {
          "role": "public-check-summary-current-check",
          "target": "public-check-summary-current-check",
          "raw_line": "$(MAKE) public-check-summary-current-check"
        },
        {
          "role": "artifact-freshness-check",
          "target": "artifact-freshness-check",
          "raw_line": "$(MAKE) artifact-freshness-check"
        },
        {
          "role": "release-post-commit-finalizer-verify",
          "target": "release-post-commit-finalizer-verify",
          "raw_line": "$(PYTHON) -m ops.scripts.release.release_post_commit_finalizer --vault \"$(VAULT)\" --mode verify --previous \"$(RELEASE_POST_COMMIT_FINALIZATION_SNAPSHOT_OUT)\" --out \"$(RELEASE_POST_COMMIT_FINALIZATION_OUT)\" --fail-on-attention"
        },
        {
          "role": "release-closeout-finality-verify",
          "target": "release-closeout-finality-verify",
          "raw_line": "$(MAKE) release-closeout-finality-verify"
        }
      ],
      "details": "release-post-commit-finalize is protected as one exact physical recipe: no prerequisites, inline recipe, duplicate rule, double-colon form, continuation, raw shell fragment, command substitution, or extra Make arguments."
    },
    {
      "id": "release_converge_preflight_protected_recipe",
      "target": "release-converge-preflight",
      "expected_lines": [
        {
          "role": "generated-artifact-script-output",
          "target": "generated-artifact-script-output",
          "raw_line": "$(MAKE) generated-artifact-script-output"
        },
        {
          "role": "report-schema-samples-regenerate",
          "target": "report-schema-samples-regenerate",
          "raw_line": "$(MAKE) report-schema-samples-regenerate"
        },
        {
          "role": "goal-runtime-local-evidence-refresh",
          "target": "goal-runtime-local-evidence-refresh",
          "raw_line": "$(MAKE) goal-runtime-local-evidence-refresh"
        },
        {
          "role": "test-execution-summary-report-contract-refresh-no-smoke",
          "target": "test-execution-summary-report-contract-refresh-no-smoke",
          "raw_line": "$(MAKE) test-execution-summary-report-contract-refresh-no-smoke"
        }
      ],
      "details": "release-converge-preflight is protected as one exact physical recipe so no raw or unmodelled work can run before script-output surfaces refresh."
    },
    {
      "id": "release_auto_promotion_preflight_prerequisites_protected_recipe",
      "target": "release-auto-promotion-preflight-prerequisites",
      "expected_lines": [
        {
          "role": "external-report-action-matrix",
          "target": "external-report-action-matrix",
          "raw_line": "$(MAKE) external-report-action-matrix"
        },
        {
          "role": "generated-artifact-index-body",
          "target": "generated-artifact-index-body",
          "raw_line": "$(MAKE) generated-artifact-index-body"
        }
      ],
      "details": "release-auto-promotion-preflight-prerequisites must stay a narrow action-matrix then generated-index-body refresh, with no full generated-core refresh."
    },
    {
      "id": "release_auto_promotion_preflight_protected_recipe",
      "target": "release-auto-promotion-preflight",
      "expected_lines": [
        {
          "role": "release-auto-promotion-ready-invalidate",
          "target": "release-auto-promotion-ready-invalidate",
          "raw_line": "$(MAKE) release-auto-promotion-ready-invalidate"
        },
        {
          "role": "release-auto-promotion-goal-run-id-guard",
          "target": "release-auto-promotion-goal-run-id-guard",
          "raw_line": "$(MAKE) release-auto-promotion-goal-run-id-guard"
        },
        {
          "role": "release-auto-promotion-preflight-prerequisites",
          "target": "release-auto-promotion-preflight-prerequisites",
          "raw_line": "$(MAKE) release-auto-promotion-preflight-prerequisites"
        },
        {
          "role": "release-smoke-fast-refresh-check",
          "target": "release-smoke-fast-refresh-check",
          "raw_line": "$(MAKE) release-smoke-fast-refresh-check"
        },
        {
          "role": "test-execution-summary-current-or-refresh",
          "target": "test-execution-summary-current-or-refresh",
          "raw_line": "$(MAKE) test-execution-summary-current-or-refresh"
        },
        {
          "role": "artifact-freshness-refresh-check",
          "target": "artifact-freshness-refresh-check",
          "raw_line": "$(MAKE) artifact-freshness-refresh-check"
        },
        {
          "role": "auto-improve-readiness-report-body-worktree-guard-refresh",
          "target": "auto-improve-readiness-report-body",
          "raw_line": "$(MAKE) auto-improve-readiness-report-body AUTO_IMPROVE_READINESS_WORKTREE_GUARD_REFRESH=1"
        },
        {
          "role": "learning-readiness-signoff-revalidation",
          "target": "learning-readiness-signoff-revalidation",
          "raw_line": "$(MAKE) learning-readiness-signoff-revalidation"
        },
        {
          "role": "remediation-backlog",
          "target": "remediation-backlog",
          "raw_line": "$(MAKE) remediation-backlog"
        },
        {
          "role": "auto-improve-readiness-report-body",